SUBMITTED_ID,FBID_KEY,ANNOTATION_SYMBOL,CYTOGENETIC_MAP,EXPERIMENTAL_CYTOLOGY,EXPERIMENTAL_RECOMBINATION_DATA,EXPERIMENTAL_RECOMBINATION_LEFT_OF,EXPERIMENTAL_RECOMBINATION_RIGHT_OF,FEATURE_TYPE,GO_BIOLOGICAL_PROCESS,GO_CELLULAR_COMPONENT,GO_MOLECULAR_FUNCTION,LOCATION_ARM,LOCATION_MAX,LOCATION_MIN,LOCATION_STRAND,MAPPED_FEATURES_MUTATIONS,NAME,RECOMBINATION_MAP,SYMBOL
FBgn0005390,FBgn0005390,CG4790,5D1-5D1,-,1-15 <newline> 1-15.6,-,-,SO0000010:protein_coding_gene,chorion-containing eggshell formation ; GO:0007304 | inferred from mutant phenotype <newline> vitelline membrane formation involved in chorion-containing eggshell formation ; GO:0007305 | inferred from mutant phenotype <newline> terminal region determination ; GO:0007362 | inferred from mutant phenotype,extracellular region ; GO:0005576 | inferred from sequence or structural similarity <newline> external side of plasma membrane ; GO:0009897 | inferred from direct assay,-,X,5964247,5958207,-1,-,female sterile (1) M3,15-Jan,fs(1)M3
FBgn0005596,FBgn0005596,CG14513,98F10-98F10,98F6-98F7; (determined by in situ hybridisation) <newline> 98F3-98F10; (determined by in situ hybridisation),3-97 <newline> 3-94.8,-,-,SO0000010:protein_coding_gene,"fertilization, exchange of chromosomal proteins ; GO:0035042 | inferred from mutant phenotype <newline> female meiotic nuclear division ; GO:0007143 | inferred from mutant phenotype",germinal vesicle ; GO:0042585 | inferred from direct assay <newline> nucleus ; GO:0005634 | inferred from direct assay <newline> male pronucleus ; GO:0001940 | inferred from direct assay <newline> kinetochore ; GO:0000776 | inferred from direct assay,DNA binding ; GO:0003677 | inferred from direct assay,3R,29122879,29118330,-1,"regulatory_region FBsf0000161287 3R:29121237..29123590 linked_to=EcoRI-StyI_rfrag comment=when this fragment is used in a reporter construct, reporter localizes to oocytes in the wild-type yem pattern; 3' coordinate of fragment is from FBrf0099845 evidence=experimental",yemanuclein,Mar-97,yem
FBgn0005655,FBgn0005655,CG9193,56F11-56F11,56F10-56F11; (determined by in situ hybridisation) <newline> 56F10-56F11; 56F10--12 56F10--13 56F10--14 56F11--14 <newline> 56E-56F; (determined by in situ hybridisation),2-92.3 <newline> 2-90 <newline> 2-96.2,-,M(2)56F,SO0000010:protein_coding_gene,"regulation of DNA replication ; GO:0006275 | inferred from electronic annotation with InterPro:IPR000730, InterPro:IPR022648, InterPro:IPR022649 <newline> leading strand elongation ; GO:0006272 | inferred from biological aspect of ancestor with PANTHER:PTN000143422 <newline> DNA-dependent DNA replication ; GO:0006261 | traceable author statement <newline> eggshell chorion gene amplification ; GO:0007307 | traceable author statement <newline> mitotic spindle organization ; GO:0007052 | inferred from mutant phenotype <newline> DNA replication ; GO:0006260 | inferred from mutant phenotype <newline> nucleotide-excision repair ; GO:0006289 | traceable author statement <newline> translesion synthesis ; GO:0019985 | inferred from biological aspect of ancestor with PANTHER:PTN000143427 <newline> antimicrobial humoral response ; GO:0019730 | inferred from mutant phenotype <newline> mismatch repair ; GO:0006298 | traceable author statement <newline> DNA replication ; GO:0006260 | traceable author statement",PCNA complex ; GO:0043626 | inferred from biological aspect of ancestor with PANTHER:PTN000143422 <newline> nucleus ; GO:0005634 | inferred from direct assay,"DNA binding ; GO:0003677 | inferred from electronic annotation with InterPro:IPR000730, InterPro:IPR022648, InterPro:IPR022649 <newline> DNA polymerase processivity factor activity ; GO:0030337 | inferred from biological aspect of ancestor with PANTHER:PTN000143422",2R,20262883,20261754,-1,protein_binding_site FBsf0000159860 2R:20263130..20263153 evidence=experimental comment=EVE/ZEN binding region I; the reference sequence contains a 5 bp deletion when compared to the sequence presented in FBrf0052576 bound_moiety=eve-XP comment=EVE/ZEN binding region I; the reference sequence contains a 5 bp deletion when compared to the sequence presented in FBrf0052576; DNaseI protection assay. bound_moiety=eve[+]P376 <newline> protein_binding_site FBsf0000159858 2R:20263091..20263108 evidence=experimental comment=EVE/ZEN binding region II; the reference sequence differs by 1 bp from the sequence presented in FBrf0052576 bound_moiety=eve-XP comment=EVE/ZEN binding region II; the reference sequence differs by 1 bp from the sequence presented in FBrf0052576; DNaseI protection assay. bound_moiety=eve[+]P376 <newline> protein_binding_site FBsf0000159859 2R:20262987..20263032 evidence=experimental comment=EVE/ZEN binding region III comment=EVE/ZEN binding region III; DNaseI protection assay. bound_moiety=eve-XP bound_moiety=eve[+]P376 <newline> protein_binding_site FBsf0000159936 2R:20262936..20262944 bound_moiety=CFDD-XP evidence=experimental <newline> protein_binding_site FBsf0000159949 2R:20262927..20262940 bound_moiety=grh-XP evidence=experimental <newline> protein_binding_site FBsf0000159950 2R:20262902..20262910 bound_moiety=CFDD-XP evidence=experimental <newline> protein_binding_site FBsf0000159951 2R:20262886..20262894 bound_moiety=CFDD-XP evidence=experimental <newline> protein_binding_site FBsf0000159952 2R:20262858..20262866 bound_moiety=E2f-XP evidence=experimental <newline> protein_binding_site FBsf0000159953 2R:20262845..20262853 bound_moiety=E2f-XP evidence=experimental,Proliferating cell nuclear antigen,Feb-90,PCNA
FBgn0005695,FBgn0005695,CG8411,44E3-44E3,-,2-59 <newline> 2-57.8,-,-,SO0000010:protein_coding_gene,"pole plasm assembly ; GO:0007315 | non-traceable author statement <newline> pole cell formation ; GO:0007279 | traceable author statement <newline> negative regulation of transcription from RNA polymerase III promoter ; GO:0016480 | inferred from mutant phenotype <newline> positive regulation of proteasomal ubiquitin-dependent protein catabolic process ; GO:0032436 | inferred from direct assay <newline> pole cell fate determination ; GO:0007278 | inferred from genetic interaction with tor inferred from genetic interaction with tsl inferred from genetic interaction with Cul3 <newline> oocyte development ; GO:0048599 | inferred from genetic interaction with Cul3 <newline> regulation of embryonic pattern specification ; GO:1902875 | inferred from genetic interaction with tsl <newline> protein polyubiquitination ; GO:0000209 | inferred from direct assay <newline> pole cell fate determination ; GO:0007278 | inferred from direct assay <newline> negative regulation of transcription, DNA-templated ; GO:0045892 | traceable author statement",nucleus ; GO:0005634 | traceable author statement <newline> extrinsic component of cytoplasmic side of plasma membrane ; GO:0031234 | inferred from direct assay <newline> nuclear pore ; GO:0005643 | inferred from direct assay <newline> nuclear envelope ; GO:0005635 | inferred from direct assay <newline> Cul3-RING ubiquitin ligase complex ; GO:0031463 | inferred from physical interaction with Cul3 <newline> cell cortex ; GO:0005938 | inferred from direct assay <newline> ubiquitin ligase complex ; GO:0000151 | inferred from biological aspect of ancestor with PANTHER:PTN001145256 <newline> nuclear periphery ; GO:0034399 | inferred from direct assay,molecular adaptor activity ; GO:0060090 | inferred from direct assay,2R,8728999,8724258,1,-,germ cell-less,Feb-59,gcl
FBgn0010014,FBgn0010014,CG4209,4F5-4F5,4F-4F <newline> 4F-4F; (determined by in situ hybridisation),1-11 <newline> 1-13.4,-,-,SO0000010:protein_coding_gene,sleep ; GO:0030431 | inferred from direct assay <newline> neurotransmitter secretion ; GO:0007269 | non-traceable author statement <newline> vesicle-mediated transport ; GO:0016192 | non-traceable author statement <newline> protein dephosphorylation ; GO:0006470 | inferred from sequence or structural similarity,calcineurin complex ; GO:0005955 | inferred from sequence or structural similarity <newline> synaptic vesicle ; GO:0008021 | non-traceable author statement,calcium ion binding ; GO:0005509 | inferred from electronic annotation with InterPro:IPR002048 <newline> calcium-dependent protein serine/threonine phosphatase regulator activity ; GO:0008597 | inferred from sequence or structural similarity <newline> calmodulin binding ; GO:0005516 | inferred from sequence or structural similarity <newline> calcium ion binding ; GO:0005509 | inferred from sequence or structural similarity,X,5334449,5332499,1,-,Calcineurin B,11-Jan,CanB
FBgn0010038,FBgn0010038,CG4181,87B8-87B8,-,3-52 <newline> 3-49.4,-,-,SO0000010:protein_coding_gene,glutathione metabolic process ; GO:0006749 | inferred from direct assay,cytoplasm ; GO:0005737 | inferred from sequence or structural similarity with RGD:70952 <newline> cytoplasm ; GO:0005737 | inferred from biological aspect of ancestor with PANTHER:PTN000136167,glutathione transferase activity ; GO:0004364 | inferred from direct assay <newline> glutathione peroxidase activity ; GO:0004602 | traceable author statement,3R,12372704,12371971,1,-,Glutathione S transferase D2,Mar-52,GstD2
FBgn0010044,FBgn0010044,CG4421,87B8-87B8,-,3-52 <newline> 3-49.5,-,-,SO0000010:protein_coding_gene,glutathione metabolic process ; GO:0006749 | inferred from direct assay,cytoplasm ; GO:0005737 | inferred from sequence or structural similarity with RGD:70952 <newline> cytoplasm ; GO:0005737 | inferred from biological aspect of ancestor with PANTHER:PTN000136167,glutathione transferase activity ; GO:0004364 | inferred from direct assay <newline> glutathione peroxidase activity ; GO:0004602 | traceable author statement,3R,12380815,12380008,1,-,Glutathione S transferase D8,Mar-52,GstD8
FBgn0010097,FBgn0010097,CG17566,37C7-37C7,37C-37D; (determined by in situ hybridisation) <newline> 37C-37C; (determined by in situ hybridisation) <newline> 37C-37C <newline> 37D-37D; (determined by in situ hybridisation),2-54 <newline> 2- <newline> 2-53.6,-,-,SO0000010:protein_coding_gene,cytoplasmic microtubule organization ; GO:0031122 | inferred from electronic annotation with InterPro:IPR002454 <newline> microtubule nucleation ; GO:0007020 | inferred from electronic annotation with InterPro:IPR002454 <newline> oocyte nucleus migration involved in oocyte dorsal/ventral axis specification ; GO:0007312 | inferred from mutant phenotype <newline> microtubule-based process ; GO:0007017 | inferred from sequence or structural similarity <newline> attachment of spindle microtubules to kinetochore involved in meiotic chromosome segregation ; GO:0051316 | inferred from mutant phenotype <newline> spindle assembly involved in female meiosis I ; GO:0007057 | inferred from mutant phenotype,"gamma-tubulin complex ; GO:0000930 | inferred from electronic annotation with InterPro:IPR002454 <newline> microtubule ; GO:0005874 | inferred from electronic annotation with InterPro:IPR000217, InterPro:IPR017975 <newline> cytoplasm ; GO:0005737 | inferred from direct assay <newline> microtubule ; GO:0005874 | inferred from sequence or structural similarity <newline> spindle ; GO:0005819 | inferred from direct assay <newline> meiotic spindle ; GO:0072687 | inferred from direct assay <newline> centrosome ; GO:0005813 | inferred from direct assay","GTPase activity ; GO:0003924 | inferred from electronic annotation with InterPro:IPR003008, InterPro:IPR008280 <newline> structural constituent of cytoskeleton ; GO:0005200 | inferred from sequence or structural similarity <newline> GTP binding ; GO:0005525 | inferred from direct assay",2L,19185726,19183863,-1,-,gamma-Tubulin at 37C,Feb-54,gammaTub37C
FBgn0010100,FBgn0010100,CG9244,39A7-39A7,39B1-39B2; (determined by in situ hybridisation) <newline> 39A6-39A7; 39B1--2,2-54.5 <newline> 2-54,-,-,SO0000010:protein_coding_gene,tricarboxylic acid cycle ; GO:0006099 | inferred from mutant phenotype,mitochondrion ; GO:0005739 | inferred from high throughput direct assay <newline> mitochondrion ; GO:0005739 | inferred from sequence or structural similarity with UniProtKB:Q99798 <newline> mitochondrion ; GO:0005739 | inferred from direct assay,"4 iron, 4 sulfur cluster binding ; GO:0051539 | inferred from electronic annotation with InterPro:IPR006248 <newline> aconitate hydratase activity ; GO:0003994 | non-traceable author statement <newline> aconitate hydratase activity ; GO:0003994 | inferred from sequence or structural similarity with UniProtKB:Q99798",2L,21173185,21168570,1,regulatory_region FBsf0000435200 2L:21169138..21169529 evidence=Reporter construct (in vivo),Aconitase,Feb-54,Acon
FBgn0010238,FBgn0010238,CG12369,49A6-49A7,-,2-67 <newline> 2-68.6,-,-,SO0000010:protein_coding_gene,"maintenance of epithelial integrity, open tracheal system ; GO:0035160 | inferred from mutant phenotype <newline> regulation of tube size, open tracheal system ; GO:0035151 | inferred from mutant phenotype <newline> homophilic cell adhesion via plasma membrane adhesion molecules ; GO:0007156 | inferred from direct assay <newline> open tracheal system development ; GO:0007424 | inferred from mutant phenotype <newline> open tracheal system development ; GO:0007424 | inferred from expression pattern inferred from mutant phenotype <newline> morphogenesis of embryonic epithelium ; GO:0016331 | inferred from mutant phenotype <newline> septate junction assembly ; GO:0019991 | inferred from mutant phenotype <newline> cell adhesion involved in heart morphogenesis ; GO:0061343 | inferred from mutant phenotype",plasma membrane ; GO:0005886 | inferred from high throughput direct assay <newline> septate junction ; GO:0005918 | inferred from direct assay,protein homodimerization activity ; GO:0042803 | inferred from direct assay,2R,12465630,12453190,1,-,Lachesin,Feb-67,Lac
FBgn0010278,FBgn0010278,CG4817,60A2-60A2,60A1-60A4 <newline> 60A1-60A4; (determined by in situ hybridisation),2-105 <newline> 2-109.4,-,-,SO0000010:protein_coding_gene,regulation of chromatin assembly or disassembly ; GO:0001672 | inferred from mutant phenotype <newline> regulation of DNA binding ; GO:0051101 | inferred from mutant phenotype <newline> negative regulation of protein phosphorylation ; GO:0001933 | inferred from mutant phenotype <newline> positive regulation of actin filament polymerization ; GO:0030838 | inferred from mutant phenotype <newline> ovarian follicle cell development ; GO:0030707 | inferred from mutant phenotype,FACT complex ; GO:0035101 | inferred from direct assay <newline> FACT complex ; GO:0035101 | traceable author statement <newline> nucleolus ; GO:0005730 | inferred from direct assay,nucleosome binding ; GO:0031491 | inferred from direct assay <newline> protein self-association ; GO:0043621 | inferred from direct assay <newline> protein binding ; GO:0005515 | inferred from physical interaction with Trl <newline> nucleosomal DNA binding ; GO:0031492 | inferred from direct assay,2R,23809004,23806361,-1,-,Structure specific recognition protein,2-105,Ssrp
FBgn0010313,FBgn0010313,CG2530,82E7-82E7,82E-82E <newline> 82E5-82E7; (determined by in situ hybridisation) 82F1--8 (determined by in situ hybridisation) <newline> 82E-82E; (determined by in situ hybridisation) <newline> 82E6-82E7; 82F1--8,3-47.1 <newline> 3- <newline> 3-44.1,-,-,SO0000010:protein_coding_gene,"regulation of gene expression ; GO:0010468 | inferred from direct assay <newline> male courtship behavior, veined wing generated song production ; GO:0045433 | inferred from mutant phenotype <newline> mitotic chromosome condensation ; GO:0007076 | inferred from mutant phenotype <newline> chromatin silencing ; GO:0006342 | inferred by curator from GO:0035098 inferred by curator from GO:0035102 <newline> epithelium development ; GO:0060429 | inferred from genetic interaction with Abd-B <newline> imaginal disc-derived wing vein specification ; GO:0007474 | inferred from mutant phenotype",polytene chromosome ; GO:0005700 | inferred from direct assay <newline> ESC/E(Z) complex ; GO:0035098 | inferred from physical interaction with UniProtKB:P42124 inferred from physical interaction with UniProtKB:Q24338 <newline> nucleus ; GO:0005634 | inferred from direct assay <newline> PRC1 complex ; GO:0035102 | inferred from physical interaction with UniProtKB:P39769 inferred from physical interaction with UniProtKB:Q9VHA0 <newline> centrosome ; GO:0005813 | inferred from direct assay,chromatin binding ; GO:0003682 | inferred from direct assay <newline> protein binding ; GO:0005515 | inferred from physical interaction with UniProtKB:P39769 inferred from physical interaction with UniProtKB:P42124 inferred from physical interaction with UniProtKB:Q24338 inferred from physical interaction with UniProtKB:Q9VHA0 <newline> protein homodimerization activity ; GO:0042803 | inferred from physical interaction with UniProtKB:P41046 <newline> identical protein binding ; GO:0042802 | inferred from physical interaction with UniProtKB:P41046,3R,5087072,5077779,-1,-,corto,3-47.1,corto
FBgn0010314,FBgn0010314,CG3738,30A8-30A8,30A-30A <newline> 30A7-30A8; (determined by in situ hybridisation),2-32 <newline> 2-35 <newline> 2-30.2,-,-,SO0000010:protein_coding_gene,"female meiotic nuclear division ; GO:0007143 | inferred from mutant phenotype <newline> syncytial blastoderm mitotic cell cycle ; GO:0035186 | inferred from mutant phenotype <newline> histoblast morphogenesis ; GO:0007488 | inferred from mutant phenotype <newline> anaphase-promoting complex-dependent catabolic process ; GO:0031145 | inferred from mutant phenotype <newline> protein phosphorylation ; GO:0006468 | inferred from mutant phenotype <newline> spindle assembly ; GO:0051225 | inferred from mutant phenotype <newline> positive regulation of cyclin-dependent protein serine/threonine kinase activity ; GO:0045737 | inferred from biological aspect of ancestor with PANTHER:PTN000602176 <newline> spindle assembly involved in female meiosis I ; GO:0007057 | inferred from mutant phenotype <newline> regulation of mitotic cell cycle ; GO:0007346 | inferred from biological aspect of ancestor with PANTHER:PTN000602176 <newline> protein phosphorylation ; GO:0006468 | inferred from sequence or structural similarity <newline> positive regulation of transcription, DNA-templated ; GO:0045893 | inferred from biological aspect of ancestor with PANTHER:PTN000602176 <newline> female meiosis I ; GO:0007144 | inferred from mutant phenotype",SCF ubiquitin ligase complex ; GO:0019005 | inferred from biological aspect of ancestor with PANTHER:PTN000602176 <newline> cyclin-dependent protein kinase holoenzyme complex ; GO:0000307 | inferred from biological aspect of ancestor with PANTHER:PTN000602176,histone binding ; GO:0042393 | inferred from biological aspect of ancestor with PANTHER:PTN000602176 <newline> protein kinase binding ; GO:0019901 | inferred from biological aspect of ancestor with PANTHER:PTN000602176 <newline> cyclin-dependent protein serine/threonine kinase activator activity ; GO:0061575 | inferred from biological aspect of ancestor with PANTHER:PTN000602176 <newline> protein binding ; GO:0005515 | inferred from physical interaction with Cdk1 inferred from physical interaction with Cdk2 <newline> ubiquitin binding ; GO:0043130 | inferred from biological aspect of ancestor with PANTHER:PTN000602176,2L,9331981,9330763,1,-,Cyclin-dependent kinase subunit 30A,Feb-35,Cks30A
