"module","modSize","bkgrModSize","rank","enrichmentP","BonferoniP","nModGenesInTerm","fracOfBkgrModSize","fracOfBkgrTermSize","bkgrTermSize","termID","termOntology","termName","termDefinition"
"salmon",146,112,7,0.00082003743264385,1,2,0.0178571428571429,0.5,4,"GO:0015174","MF","basic amino acid transmembrane transporter activity","Enables the transfer of basic amino acids from one side of a membrane to the other. Basic amino acids have a pH above 7."
"salmon",146,112,8,0.00096607934929667,1,8,0.0714285714285714,0.0465116279069767,172,"GO:0043161","BP","proteasome-mediated ubiquitin-dependent protein catabolic process","The chemical reactions and pathways resulting in the breakdown of a protein or peptide by hydrolysis of its peptide bonds, initiated by the covalent attachment of ubiquitin, and mediated by the proteasome."
"salmon",146,112,9,0.00129526798647964,1,8,0.0714285714285714,0.0444444444444444,180,"GO:0010498","BP","proteasomal protein catabolic process","The chemical reactions and pathways resulting in the breakdown of a protein or peptide by hydrolysis of its peptide bonds that is mediated by the proteasome."
"salmon",146,112,10,0.0015883251553254,1,3,0.0267857142857143,0.15,20,"GO:0015179","MF","L-amino acid transmembrane transporter activity","Enables the transfer of an L-amino acid from one side of a membrane to the other. L-amino acids are the L-enantiomers of amino acids."
"skyblue",50,48,1,0.00189603914612754,1,2,0.0416666666666667,0.153846153846154,13,"GO:0032266","MF","phosphatidylinositol-3-phosphate binding","Interacting selectively and non-covalently with phosphatidylinositol-3-phosphate, a derivative of phosphatidylinositol in which the inositol ring is phosphorylated at the 3' position."
"skyblue",50,48,2,0.00326343888212039,1,2,0.0416666666666667,0.117647058823529,17,"GO:0005283","MF","amino acid:sodium symporter activity","Enables the transfer of a solute or solutes from one side of a membrane to the other according to the reaction: amino acid(out) + Na+(out) = amino acid(in) + Na+(in)."
"skyblue",50,48,3,0.00365952863396424,1,2,0.0416666666666667,0.111111111111111,18,"GO:0005416","MF","amino acid:cation symporter activity","Enables the transfer of a solute or solutes from one side of a membrane to the other according to the reaction: amino acid(out) + cation(out) = amino acid(in) + cation(in)."
"skyblue",50,48,4,0.00451526266772071,1,2,0.0416666666666667,0.1,20,"GO:0090306","BP","spindle assembly involved in meiosis","The aggregation, arrangement and bonding together of a set of components to form the spindle that contributes to the process of meiosis."
"skyblue",50,48,5,0.00507185122569787,1,1,0.0208333333333333,1,1,"GO:0034709","CC","methylosome","A large (20 S) protein complex that possesses protein arginine methyltransferase activity and modifies specific arginines to dimethylarginines in the arginine- and glycine-rich domains of several spliceosomal Sm proteins, thereby targeting these proteins to the survival of motor neurons (SMN) complex for assembly into small nuclear ribonucleoprotein (snRNP) core particles. Proteins found in the methylosome include the methyltransferase JBP1 (PRMT5), pICln (CLNS1A), MEP50 (WDR77), and unmethylated forms of SM proteins that have RG domains."
"skyblue",50,48,6,0.00507185122569787,1,1,0.0208333333333333,1,1,"GO:0034648","MF","histone demethylase activity (H3-dimethyl-K4 specific)","Catalysis of the removal of a methyl group from dimethylated lysine at position 4 of the histone H3 protein."
"skyblue",50,48,7,0.00545429955519305,1,2,0.0416666666666667,0.0909090909090909,22,"GO:0051310","BP","metaphase plate congression","The alignment of chromosomes at the metaphase plate (spindle equator), a plane halfway between the poles of the spindle."
"skyblue",50,48,8,0.00647493730733592,1,2,0.0416666666666667,0.0833333333333333,24,"GO:1900073","BP","regulation of neuromuscular synaptic transmission",NA
"skyblue",50,48,9,0.00647493730733592,1,2,0.0416666666666667,0.0833333333333333,24,"GO:0005328","MF","neurotransmitter:sodium symporter activity","Enables the transfer of a solute or solutes from one side of a membrane to the other according to the reaction: neurotransmitter(out) + Na+(out) = neurotransmitter(in) + Na+(in)."
"skyblue",50,48,10,0.00701533139114975,1,2,0.0416666666666667,0.08,25,"GO:0051303","BP","establishment of chromosome localization","The directed movement of a chromosome to a specific location."
"steelblue",41,33,1,0.00348689771766708,1,1,0.0303030303030303,1,1,"GO:0015724","BP","formate transport","The directed movement of formate into, out of or within a cell, or between cells, by means of some agent such as a transporter or pore."
"steelblue",41,33,2,0.00348689771766708,1,1,0.0303030303030303,1,1,"GO:0019532","BP","oxalate transport","The directed movement of oxalate into, out of or within a cell, or between cells, by means of some agent such as a transporter or pore. Oxalate, or ethanedioic acid, occurs in many plants and is highly toxic to animals."
"steelblue",41,33,3,0.00348689771766708,1,1,0.0303030303030303,1,1,"GO:0045804","BP","negative regulation of eclosion","Any process that stops, prevents, or reduces the frequency, rate or extent of eclosion."
"steelblue",41,33,4,0.00348689771766708,1,1,0.0303030303030303,1,1,"GO:0060100","BP","positive regulation of phagocytosis, engulfment","Any process that activates or increases the frequency, rate or extent of the internalization of bacteria, immune complexes and other particulate matter or of an apoptotic cell by phagocytosis."
"steelblue",41,33,5,0.00348689771766708,1,1,0.0303030303030303,1,1,"GO:0070935","BP","3'-UTR-mediated mRNA stabilization","An mRNA stabilization process in which one or more RNA-binding proteins associate with the 3'-untranslated region (UTR) of an mRNA."
"steelblue",41,33,6,0.00348689771766708,1,1,0.0303030303030303,1,1,"GO:2000767","BP","positive regulation of cytoplasmic translation","Any process that activates or increases the frequency, rate or extent of cytoplasmic translation."
"steelblue",41,33,7,0.00348689771766708,1,1,0.0303030303030303,1,1,"GO:0015499","MF","formate transmembrane transporter activity","Enables the transfer of formate from one side of a membrane to the other. Formate is also known as methanoate, the anion HCOO- derived from methanoic (formic) acid."
"steelblue",41,33,8,0.00348689771766708,1,1,0.0303030303030303,1,1,"GO:0019531","MF","oxalate transmembrane transporter activity","Enables the transfer of oxalate from one side of a membrane to the other. Oxalate, or ethanedioic acid, occurs in many plants and is highly toxic to animals."
"steelblue",41,33,9,0.00348689771766708,1,1,0.0303030303030303,1,1,"GO:0030616","MF","transforming growth factor beta receptor, common-partner cytoplasmic mediator activity","A TGF-beta cytoplasmic mediator that forms a complex with a phosphorylated pathway-specific mediator. The heterocomplex translocates to the nucleus to regulate transcription."
"steelblue",41,33,10,0.00348689771766708,1,1,0.0303030303030303,1,1,"GO:1990605","MF","GU repeat RNA binding","Interacting selectively and non-covalently with an RNA molecule containing GU repeats."
"tan",146,123,1,9.05440994005033e-05,0.759031185274419,4,0.032520325203252,0.210526315789474,19,"GO:0030136","CC","clathrin-coated vesicle","A vesicle with a coat formed of clathrin connected to the membrane via one of the clathrin adaptor complexes."
"tan",146,123,2,0.00014930159339833,1,13,0.105691056910569,0.0429042904290429,303,"GO:0031410","CC","cytoplasmic vesicle","A vesicle found in the cytoplasm of a cell."
"tan",146,123,3,0.000338782819919084,1,5,0.040650406504065,0.106382978723404,47,"GO:0030135","CC","coated vesicle","Small membrane-bounded organelle formed by pinching off of a coated region of membrane. Some coats are made of clathrin, whereas others are made from other proteins."
"tan",146,123,4,0.00045813888744775,1,13,0.105691056910569,0.0382352941176471,340,"GO:0031982","CC","vesicle","Any small, fluid-filled, spherical organelle enclosed by membrane."
"tan",146,123,5,0.000498384180644562,1,2,0.016260162601626,0.666666666666667,3,"GO:0006573","BP","valine metabolic process","The chemical reactions and pathways involving valine, 2-amino-3-methylbutanoic acid."
"tan",146,123,6,0.000498384180644562,1,2,0.016260162601626,0.666666666666667,3,"GO:0019835","BP","cytolysis","The rupture of cell membranes and the loss of cytoplasm."
"tan",146,123,7,0.00163311740273208,1,2,0.016260162601626,0.4,5,"GO:0047617","MF","acyl-CoA hydrolase activity","Catalysis of the reaction: acyl-CoA + H2O = CoA + a carboxylate."
"tan",146,123,8,0.00445723050530897,1,2,0.016260162601626,0.25,8,"GO:0030131","CC","clathrin adaptor complex","A membrane coat adaptor complex that links clathrin to a membrane."
"tan",146,123,9,0.00454618600189752,1,4,0.032520325203252,0.0769230769230769,52,"GO:0008565","MF","protein transporter activity","Enables the directed movement of proteins into, out of or within a cell, or between cells."
"tan",146,123,10,0.0056821621788548,1,2,0.016260162601626,0.222222222222222,9,"GO:0035567","BP","non-canonical Wnt signaling pathway","The series of molecular signals initiated by binding of a Wnt protein to a frizzled family receptor on the surface of the target cell, followed by propagation of the signal via effectors other than beta-catenin."
"turquoise",3050,2500,1,0.000374182792433545,1,87,0.0348,0.364016736401674,239,"GO:0045202","CC","synapse","The junction between a nerve fiber of one neuron and another neuron, muscle fiber or glial cell. As the nerve fiber approaches the synapse it enlarges into a specialized structure, the presynaptic nerve ending, which contains mitochondria and synaptic vesicles. At the tip of the nerve ending is the presynaptic membrane; facing it, and separated from it by a minute cleft (the synaptic cleft) is a specialized area of membrane on the receiving cell, known as the postsynaptic membrane. In response to the arrival of nerve impulses, the presynaptic nerve ending secretes molecules of neurotransmitters into the synaptic cleft. These diffuse across the cleft and transmit the signal to the postsynaptic membrane."
"turquoise",3050,2500,2,0.00139527089790328,1,49,0.0196,0.388888888888889,126,"GO:0098793","CC","presynapse","The part of a synapse that is part of the presynaptic cell."
"turquoise",3050,2500,3,0.00190332723267322,1,7,0.0028,0.777777777777778,9,"GO:0004683","MF","calmodulin-dependent protein kinase activity","Catalysis of the reactions: ATP + a protein serine = ADP + protein serine phosphate; and ATP + a protein threonine = ADP + protein threonine phosphate. These reactions require the presence of calcium-bound calmodulin."
"turquoise",3050,2500,4,0.00247759144666886,1,26,0.0104,0.440677966101695,59,"GO:0097060","CC","synaptic membrane","A specialized area of membrane on either the presynaptic or the postsynaptic side of a synapse, the junction between a nerve fiber of one neuron and another neuron or muscle fiber or glial cell."
"turquoise",3050,2500,5,0.00403040585043255,1,8,0.0032,0.666666666666667,12,"GO:0007305","BP","vitelline membrane formation involved in chorion-containing eggshell formation","Construction of the vitelline membrane portion of a chorion-containing eggshell. An example of this is found in Drosophila melanogaster."
"turquoise",3050,2500,6,0.00560941258631323,1,27,0.0108,0.415384615384615,65,"GO:0043679","CC","axon terminus","Terminal inflated portion of the axon, containing the specialized apparatus necessary to release neurotransmitters. The axon terminus is considered to be the whole region of thickening and the terminal button is a specialized region of it."
"turquoise",3050,2500,7,0.00582334897167927,1,220,0.088,0.305131761442441,721,"GO:0006508","BP","proteolysis","The hydrolysis of proteins into smaller polypeptides and/or amino acids by cleavage of their peptide bonds."
"turquoise",3050,2500,8,0.00615549790313895,1,18,0.0072,0.461538461538462,39,"GO:0005179","MF","hormone activity","The action characteristic of a hormone, any substance formed in very small amounts in one specialized organ or group of cells and carried (sometimes in the bloodstream) to another organ or group of cells in the same organism, upon which it has a specific regulatory action. The term was originally applied to agents with a stimulatory physiological action in vertebrate animals (as opposed to a chalone, which has a depressant action). Usage is now extended to regulatory compounds in lower animals and plants, and to synthetic substances having comparable effects; all bind receptors and trigger some biological process."
"turquoise",3050,2500,9,0.0061757560353895,1,11,0.0044,0.55,20,"GO:0019905","MF","syntaxin binding","Interacting selectively and non-covalently with a syntaxin, a SNAP receptor involved in the docking of synaptic vesicles at the presynaptic zone of a synapse."
"turquoise",3050,2500,10,0.0062071800089946,1,9,0.0036,0.6,15,"GO:0085029","BP","extracellular matrix assembly","The aggregation, arrangement and bonding together of the extracellular matrix."
"white",51,38,1,0.00205543577045295,1,2,0.0526315789473684,0.117647058823529,17,"GO:0008362","BP","chitin-based embryonic cuticle biosynthetic process","Synthesis, including the chemical reactions and pathways resulting in the formation of chitin and other components, and deposition of a chitin-based embryonic cuticle by the underlying epidermal epithelium. This tough, waterproof cuticle layer is essential to provide structural integrity of the larval body. An example of this is found in Drosophila melanogaster."
"white",51,38,2,0.002571363111715,1,2,0.0526315789473684,0.105263157894737,19,"GO:0018024","MF","histone-lysine N-methyltransferase activity","Catalysis of the reaction: S-adenosyl-L-methionine + histone L-lysine = S-adenosyl-L-homocysteine + histone N6-methyl-L-lysine. The methylation of peptidyl-lysine in histones forms N6-methyl-L-lysine, N6,N6-dimethyl-L-lysine and N6,N6,N6-trimethyl-L-lysine derivatives."
"white",51,38,3,0.00376613285960827,1,2,0.0526315789473684,0.0869565217391304,23,"GO:0016279","MF","protein-lysine N-methyltransferase activity","Catalysis of the transfer of a methyl group from S-adenosyl-L-methionine to the epsilon-amino group of a lysine residue in a protein substrate."
"white",51,38,4,0.00401521555367701,1,1,0.0263157894736842,1,1,"GO:0010226","BP","response to lithium ion","Any process that results in a change in state or activity of a cell or an organism (in terms of movement, secretion, enzyme production, gene expression, etc.) as a result of a lithium (Li+) ion stimulus."
"white",51,38,5,0.00401521555367701,1,1,0.0263157894736842,1,1,"GO:0030948","BP","negative regulation of vascular endothelial growth factor receptor signaling pathway","Any process that stops, prevents, or reduces the frequency, rate or extent of vascular endothelial growth factor receptor signaling pathway activity."
"white",51,38,6,0.00401521555367701,1,1,0.0263157894736842,1,1,"GO:0000806","CC","Y chromosome","The sex chromosome present in males of species in which the male is the heterogametic sex; generally, the sex chromosome that pairs with the X chromosome in the heterogametic sex. The Y chromosome is absent from the cells of females and present in one copy in the somatic cells of males."
"white",51,38,7,0.00401521555367701,1,1,0.0263157894736842,1,1,"GO:0042767","MF","ecdysteroid 22-hydroxylase activity","Catalysis of the hydroxylation of an ecdysteroid at carbon position 22."
"white",51,38,8,0.00401521555367701,1,1,0.0263157894736842,1,1,"GO:0071567","MF","UFM1 hydrolase activity","Catalysis of the hydrolysis of UFM1, a small ubiquitin-related modifier, from previously modified substrates."
"white",51,38,9,0.00517242689480213,1,2,0.0526315789473684,0.0740740740740741,27,"GO:0071456","BP","cellular response to hypoxia","Any process that results in a change in state or activity of a cell (in terms of movement, secretion, enzyme production, gene expression, etc.) as a result of a stimulus indicating lowered oxygen tension. Hypoxia, defined as a decline in O2 levels below normoxic levels of 20.8 - 20.95%, results in metabolic adaptation at both the cellular and organismal level."
"white",51,38,10,0.00555626246903586,1,2,0.0526315789473684,0.0714285714285714,28,"GO:0042054","MF","histone methyltransferase activity","Catalysis of the reaction: S-adenosyl-L-methionine + histone = S-adenosyl-L-homocysteine + methyl-histone. Histone methylation generally occurs on either an arginine or lysine residue."
